{
  "bpiVersion": "0.1.0-draft",
  "msgType": "SessionState",
  "msgId": "018f3a10-0000-7000-8000-000000000202",
  "issuedAt": "2026-08-22T06:12:04.100Z",
  "issuer": {
    "org": "Solaris Orbital Power Ltd",
    "role": "SPACE"
  },
  "sig": {
    "alg": "EdDSA",
    "keyId": "test-key-2026-08",
    "value": "eyJhbGciOiJFZERTQSIsImtpZCI6InRlc3Qta2V5LTIwMjYtMDgifQ..0WRfdl-dSwrXjbYm0g8NO-Z5645oFHBniQJxbEAq1rDSUY-8RSp0y9h0ErAoaeoEYtYhG7fMbrfaQ0VJCzf6Aw"
  },
  "sessionId": "sess-2026-08-22-0612",
  "state": "DELIVERING",
  "radiatedPower_kW": 94210,
  "radiatedPower_kW_prov": "measured",
  "honouringToken": {
    "tokenId": "tok-4211",
    "seq": 4211
  },
  "pointing": {
    "lockState": "LOCKED",
    "quality": 0.97,
    "corridorErrorDeg": 0.031,
    "solutionSource": "FUSED",
    "pilotAuthenticated": true
  },
  "faults": []
}
